{
  "schemaVersion": "1.0.0",
  "id": "SB-PY-SV-003",
  "track": "core",
  "caseType": "synthetic_vulnerable",
  "language": "python",
  "canonicalKind": "command_injection",
  "title": "Task Assistant Agent — Unsanitised Command Construction",
  "description": "A task assistant agent receives user messages describing tasks. The tool dispatcher constructs shell commands by string-formatting user-supplied task descriptions directly into a command template and passes the result to subprocess.run with shell=True. An attacker can inject shell metacharacters in the task description to execute arbitrary commands.",
  "files": {
    "root": "project/"
  },
  "regions": [
    {
      "id": "R1",
      "path": "tools/task_executor.py",
      "startLine": 20,
      "endLine": 52,
      "label": "vulnerable",
      "capability": "code_execution",
      "acceptedKinds": ["command_injection"]
    }
  ],
  "expectedOutcome": {
    "mustDetectRegionIds": ["R1"],
    "mustNotFlagRegionIds": []
  },
  "standards": {
    "owaspAgenticTop10": {
      "primary": "ASI01",
      "secondary": ["ASI02"]
    }
  }
}
