{
  "schemaVersion": "1.0.0",
  "id": "SB-TS-RW-010",
  "track": "full",
  "caseType": "real_world_disclosed",
  "language": "typescript",
  "canonicalKind": "authz_bypass",
  "title": "device.token.rotate could mint scopes broader than caller held",
  "description": "The rotateDeviceToken function in device-pairing.ts accepts arbitrary scopes from the caller without checking whether the requested scopes exceed the device's originally approved scope baseline. A device with operator.read can call rotate with scopes=['operator.admin'] and receive a new token with elevated privileges, because the function blindly applies the requested scopes to the new token and updates device.scopes without any scope containment validation.",
  "files": {
    "root": "../../../../.repos/openclaw_openclaw__40a29261/"
  },
  "regions": [
    {
      "id": "R1",
      "path": "src/infra/device-pairing.ts",
      "startLine": 508,
      "endLine": 544,
      "label": "vulnerable",
      "capability": "authorization",
      "acceptedKinds": [
        "authz_bypass"
      ]
    }
  ],
  "expectedOutcome": {
    "mustDetectRegionIds": [
      "R1"
    ],
    "mustNotFlagRegionIds": []
  },
  "realWorld": {
    "repo": "openclaw/openclaw",
    "vulnerableCommit": "40a292619e1f2be3a3b1db663d7494c9c2dc0abf",
    "fixCommit": "914a7c5359ccf3a0130da6517701cc8fb7ad86bd",
    "ghsa": "GHSA-4jpw-hj22-2xmc",
    "cve": "",
    "disclosure": {
      "ghsaPublished": "2026-03-13",
      "fixCommitDate": "2026-02-20"
    }
  },
  "standards": {
    "owaspAgenticTop10": {
      "primary": "ASI03"
    }
  },
  "prSimulation": {
    "mode": "git_commit_pair",
    "baseCommit": "60ad2c2e96ac0cfe206c1ea1e7c4627035857de5",
    "headCommit": "b9aed3a07c45a6e2469e07b385495dbcba438a2a"
  }
}
