{
  "schemaVersion": "1.0.0",
  "id": "SB-TS-RW-003",
  "track": "full",
  "caseType": "real_world_disclosed",
  "language": "typescript",
  "canonicalKind": "auth_bypass",
  "title": "Inbound voice-call allowlist bypass via empty caller ID",
  "description": "The CallManager.shouldAcceptInbound method uses a suffix-matching comparison to validate inbound caller IDs against an allowlist. When the caller ID is missing or empty, the normalized value becomes an empty string, and the endsWith check returns true for every allowlisted number because every string ends with the empty string. This allows anonymous callers to bypass the allowlist entirely.",
  "files": {
    "root": "../../../../.repos/openclaw_openclaw__fc40ba8e/"
  },
  "regions": [
    {
      "id": "R1",
      "path": "extensions/voice-call/src/manager.ts",
      "startLine": 463,
      "endLine": 487,
      "label": "vulnerable",
      "capability": "authentication",
      "acceptedKinds": [
        "auth_bypass"
      ]
    }
  ],
  "expectedOutcome": {
    "mustDetectRegionIds": [
      "R1"
    ],
    "mustNotFlagRegionIds": []
  },
  "realWorld": {
    "repo": "openclaw/openclaw",
    "vulnerableCommit": "fc40ba8e7eb1345afdb1c8d274219cd702b73354",
    "fixCommit": "f8dfd034f5d9235c5485f492a9e4ccc114e97fdb",
    "ghsa": "GHSA-4rj2-gpmh-qq5x",
    "cve": "",
    "disclosure": {
      "ghsaPublished": "2026-02-17",
      "fixCommitDate": "2026-02-03"
    }
  },
  "standards": {
    "owaspAgenticTop10": {
      "primary": "ASI03"
    }
  },
  "prSimulation": {
    "mode": "git_commit_pair",
    "baseCommit": "3467b0ba074cba456cf20d2178faff96bacaeafb"
  }
}
