{
  "schemaVersion": "1.0.0",
  "id": "SB-RS-SV-002",
  "track": "core",
  "caseType": "synthetic_vulnerable",
  "language": "rust",
  "canonicalKind": "command_injection",
  "title": "Local Build Helper Agent — Command Injection via Task Parameters",
  "description": "A local CI/build helper agent constructs shell commands from unchecked task parameters produced by an LLM planner. Target names, feature flags, and test filters are string-interpolated into a command passed to sh -c without allowlist validation, enabling command injection.",
  "files": {
    "root": "project/"
  },
  "regions": [
    {
      "id": "R1",
      "path": "project/src/tools/build_runner.rs",
      "startLine": 23,
      "endLine": 100,
      "label": "vulnerable",
      "capability": "code_execution",
      "acceptedKinds": ["command_injection"]
    }
  ],
  "expectedOutcome": {
    "mustDetectRegionIds": ["R1"],
    "mustNotFlagRegionIds": []
  }
}
