{
  "schemaVersion": "1.0.0",
  "id": "SB-TS-RW-015",
  "track": "full",
  "caseType": "real_world_disclosed",
  "language": "typescript",
  "canonicalKind": "auth_bypass",
  "title": "Telegram webhook request bodies read before secret validation (unauthenticated resource exhaustion)",
  "description": "The Telegram webhook HTTP handler reads and parses the full JSON request body (up to 1 MB, with a 30-second timeout) before checking the X-Telegram-Bot-Api-Secret-Token header. An unauthenticated attacker can send large or slow-drip request bodies to exhaust server resources because the expensive body-reading operation precedes the lightweight secret token comparison.",
  "files": {
    "root": "../../../../.repos/openclaw_openclaw__1ef0aa44/"
  },
  "regions": [
    {
      "id": "R1",
      "path": "src/telegram/webhook.ts",
      "startLine": 139,
      "endLine": 168,
      "label": "vulnerable",
      "capability": "authentication",
      "acceptedKinds": [
        "auth_bypass"
      ]
    }
  ],
  "expectedOutcome": {
    "mustDetectRegionIds": [
      "R1"
    ],
    "mustNotFlagRegionIds": []
  },
  "realWorld": {
    "repo": "openclaw/openclaw",
    "vulnerableCommit": "1ef0aa443b2f5c9bc4825659d83a532998d8307b",
    "fixCommit": "7e49e98f79073b11134beac27fdff547ba5a4a02",
    "ghsa": "GHSA-jq3f-vjww-8rq7",
    "cve": "",
    "disclosure": {
      "ghsaPublished": "2026-03-16",
      "fixCommitDate": "2026-03-13"
    }
  },
  "standards": {
    "owaspAgenticTop10": {
      "primary": "ASI03"
    }
  },
  "prSimulation": {
    "mode": "git_commit_pair",
    "baseCommit": "b8b43175c5b896b6edc3a07813c16c0df165e0a2",
    "headCommit": "ee594e2fdb718da52e87a41d0414b16c322a9af6"
  }
}
