{
  "schemaVersion": "1.0.0",
  "id": "SB-TS-RW-029",
  "track": "full",
  "caseType": "real_world_disclosed",
  "language": "typescript",
  "canonicalKind": "sql_injection",
  "title": "n8n SQL injection in MySQL, PostgreSQL, and Microsoft SQL database nodes",
  "description": "The MySQL, PostgreSQL, and Microsoft SQL database nodes in n8n build parts of SQL queries from workflow-controlled configuration without consistently validating or safely escaping those fragments. In the vulnerable snapshot, MySQL and PostgreSQL interpolate unvalidated where-clause operators into SQL, MySQL also interpolates sort direction directly into ORDER BY, and the Microsoft SQL node concatenates unescaped identifier fields into SELECT, UPDATE, and DELETE queries. An authenticated user with workflow editing permissions can inject arbitrary SQL through crafted node configuration.",
  "files": {
    "root": "../../../../.repos/n8n-io_n8n__9ce3ac09/"
  },
  "regions": [
    {
      "id": "R1",
      "path": "packages/nodes-base/nodes/MySql/v2/helpers/utils.ts",
      "startLine": 480,
      "endLine": 536,
      "label": "vulnerable",
      "capability": "data_store",
      "acceptedKinds": [
        "sql_injection"
      ]
    },
    {
      "id": "R2",
      "path": "packages/nodes-base/nodes/MySql/v2/helpers/utils.ts",
      "startLine": 538,
      "endLine": 554,
      "label": "vulnerable",
      "capability": "data_store",
      "acceptedKinds": [
        "sql_injection"
      ]
    },
    {
      "id": "R3",
      "path": "packages/nodes-base/nodes/Postgres/v2/helpers/utils.ts",
      "startLine": 129,
      "endLine": 188,
      "label": "vulnerable",
      "capability": "data_store",
      "acceptedKinds": [
        "sql_injection"
      ]
    },
    {
      "id": "R4",
      "path": "packages/nodes-base/nodes/Microsoft/Sql/GenericFunctions.ts",
      "startLine": 89,
      "endLine": 93,
      "label": "vulnerable",
      "capability": "data_store",
      "acceptedKinds": [
        "sql_injection"
      ]
    },
    {
      "id": "R5",
      "path": "packages/nodes-base/nodes/Microsoft/Sql/GenericFunctions.ts",
      "startLine": 176,
      "endLine": 200,
      "label": "vulnerable",
      "capability": "data_store",
      "acceptedKinds": [
        "sql_injection"
      ]
    },
    {
      "id": "R6",
      "path": "packages/nodes-base/nodes/Microsoft/Sql/GenericFunctions.ts",
      "startLine": 203,
      "endLine": 238,
      "label": "vulnerable",
      "capability": "data_store",
      "acceptedKinds": [
        "sql_injection"
      ]
    }
  ],
  "expectedOutcome": {
    "mustDetectRegionIds": [
      "R1",
      "R3"
    ],
    "mustNotFlagRegionIds": []
  },
  "realWorld": {
    "repo": "n8n-io/n8n",
    "vulnerableCommit": "9ce3ac092cf7339f3c4a416cdea6e5fa2d5b22b9",
    "fixCommit": "f73fae6fe7fc34907bba102648a9997186aa4385",
    "ghsa": "GHSA-f3f2-mcxc-pwjx",
    "disclosure": {
      "ghsaPublished": "2026-02-26",
      "fixCommitDate": "2026-01-09"
    }
  },
  "standards": {
    "owaspAgenticTop10": {
      "primary": "ASI02",
      "secondary": []
    }
  },
  "fixValidation": {
    "mode": "mitigation_anchor_present",
    "anchors": [
      {
        "path": "packages/nodes-base/nodes/MySql/v2/helpers/utils.ts",
        "mustContainAll": ["conditionSet", "getWhereClauses"]
      },
      {
        "path": "packages/nodes-base/nodes/MySql/v2/actions/database/select.operation.ts",
        "mustContainAll": ["const whereClauses = getWhereClauses(this, i)"]
      },
      {
        "path": "packages/nodes-base/nodes/Postgres/v2/helpers/utils.ts",
        "mustContainAll": ["conditionSet", "getWhereClauses"]
      },
      {
        "path": "packages/nodes-base/nodes/Postgres/v2/actions/database/select.operation.ts",
        "mustContainAll": ["const whereClauses = getWhereClauses(this, i)"]
      }
    ]
  },
  "prSimulation": {
    "mode": "git_commit_pair",
    "baseCommit": "29959be6883d48c0385f333b3d9798a8c7c91c43"
  }
}
