{
  "schemaVersion": "1.0.0",
  "id": "SB-TS-RW-007",
  "track": "full",
  "caseType": "real_world_disclosed",
  "language": "typescript",
  "canonicalKind": "command_injection",
  "title": "system.run approvals did not bind PATH-token executable identity",
  "description": "The sanitizeSystemRunParamsForForwarding function in the gateway validates approval records for system.run commands but trusts the caller-supplied command, rawCommand, cwd, agentId, and sessionKey parameters verbatim when forwarding. After an approval is granted for a specific command, the caller can substitute different values for these fields before execution, running a different command or in a different directory than what was approved. The approval binding only verifies the run ID and node/device identity, not the immutable execution plan.",
  "files": {
    "root": "../../../../.repos/openclaw_openclaw__611dff98/"
  },
  "regions": [
    {
      "id": "R1",
      "path": "src/gateway/node-invoke-system-run-approval.ts",
      "startLine": 87,
      "endLine": 123,
      "label": "vulnerable",
      "capability": "code_execution",
      "acceptedKinds": [
        "command_injection"
      ]
    }
  ],
  "expectedOutcome": {
    "mustDetectRegionIds": [
      "R1"
    ],
    "mustNotFlagRegionIds": []
  },
  "realWorld": {
    "repo": "openclaw/openclaw",
    "vulnerableCommit": "611dff985d4ecc442633a740f0918d9eb5c6bf36",
    "fixCommit": "78a7ff2d50fb3bcef351571cb5a0f21430a340c1",
    "ghsa": "GHSA-q399-23r3-hfx4",
    "cve": "",
    "disclosure": {
      "ghsaPublished": "2026-03-02",
      "fixCommitDate": "2026-02-26"
    }
  },
  "standards": {
    "owaspAgenticTop10": {
      "primary": "ASI03",
      "secondary": [
        "ASI05"
      ]
    }
  },
  "prSimulation": {
    "mode": "git_commit_pair",
    "baseCommit": "4894d907faa7540ca8b6835f561a6dd3ea824b77",
    "headCommit": "10481097f8e6dd0346db9be0b5f27570e1bdfcfa"
  }
}
